公司,名称,地址,学历,福利,经验,职位类型,薪资
 江苏硕华建设有限公司 ,现金会计, 谷里 ,大专,加班补助,1-2年,会计/会计师,面议
 南京家家赢水产有限公司 ,会计/会计师, 谷里 ,不限,,不限,会计/会计师,3000-5000
 安徽省亳州市药材总公司 ,会计, 谷里 ,大专,"五险一金,周末双休,话补,饭补,加班补助",1-2年,会计/会计师,面议
 南京永华旧机动车交易市场管理… ,会计, 谷里 ,大专,"包吃,包住",3-5年,会计/会计师,3500-5000
 中天建设集团有限公司 ,会计/会计师, 谷里 ,不限,,不限,会计/会计师,面议
 南京同旭暖通工程有限公司 ,财务, 谷里 ,不限,"五险一金,话补,年底双薪,周末双休,加班补助",不限,会计/会计师,3500-4500
 南京仁爱钢构彩板有限公司 ,会计, 谷里 ,不限,"包吃,饭补",1年以下,会计/会计师,3000-5000
 南京首各科技有限公司 ,现金会计, 谷里 ,大专,周末双休,1-2年,会计/会计师,面议
 南京华勇建筑工程有限公司 ,会计, 谷里 ,不限,,不限,会计/会计师,5000-10000
 南京圣知锐建材实业有限公司 ,会计/审计, 谷里 ,大专,"包吃,包住",3-5年,会计/会计师,6000-8000
 南京玉源财务管理有限公司 ,会计/会计师, 谷里 ,不限,五险一金,不限,会计/会计师,面议
 南京大掌柜财务管理咨询有限公司 ,2020年会计实习生招聘, 谷里 ,大专,"年底双薪,周末双休,五险一金,交通补助,加班补助",不限,会计/会计师,面议
 南京闫之有味餐饮管理有限公司 ,会计, 谷里 ,不限,"包吃,年底双薪,加班补助",1-2年,会计/会计师,4000-5000
 南京衡度财务管理咨询有限公司 ,会计, 谷里 ,不限,"五险一金,周末双休",不限,会计/会计师,4000-5000
 南京超味食品有限公司 ,会计, 谷里 ,不限,,不限,会计/会计师,3000-5000
 南京大掌柜财务管理咨询有限公司 ,2020会计招聘, 谷里 ,大专,"年底双薪,周末双休",不限,会计/会计师,面议
 南京恒铭建材有限公司 ,会计, 谷里 ,本科,"话补,交通补助,饭补",3-5年,会计/会计师,3000-5000
 南京轲络商贸有限公司 ,会计/会计师, 谷里 ,不限,,不限,会计/会计师,6000-8000
 南京佑越婷医院管理有限公司 ,会计, 谷里 ,不限,"五险一金,包住,饭补",1-2年,会计/会计师,4000-8000
 南京市浦口区思越会计服务中心 ,会计学徒, 谷里 ,不限,,不限,会计/会计师,2000-3500
 南京国美文化传播有限公司 ,会计/会计师, 谷里 ,不限,"五险一金,饭补,加班补助",不限,会计/会计师,3000-5000
 南京大锅饭饮食服务有限公司 ,诚招会计高薪, 谷里 ,不限,"包吃,包住,加班补助,饭补,交通补助",不限,会计/会计师,面议
 江苏八强工程项目管理咨询有限… ,总账会计, 谷里 ,大专,,6-7年,会计/会计师,4500-5000
 南京泷泽财务有限公司 ,招聘会计, 谷里 ,大专,"周末双休,交通补助,话补,饭补,年底双薪",3-5年,会计/会计师,面议
 南京双舟贸易有限公司 ,会计员, 谷里 ,不限,"包住,包吃",不限,会计/会计师,面议
 南京慧发会计服务有限公司 ,诚聘会计包吃法定休, 谷里 ,大专,"包吃,交通补助,加班补助,饭补",1-2年,会计/会计师,面议
 杭州华运国际旅行社有限公司南… ,会计, 谷里 ,大专,"包住,年底双薪,房补,话补,交通补助",不限,会计/会计师,4000-6000
 南京采之鑫财务管理有限公司 ,财务会计, 谷里 ,大专,周末双休,不限,会计/会计师,面议
 南京奋发企业管理有限公司 ,会计, 谷里 ,不限,五险一金,不限,会计/会计师,4000-5000
 南京越洋初级农产品销售有限公司 ,会计/会计师, 西善桥 ,不限,五险一金,不限,会计/会计师,3000-5000
 南京越洋初级农产品销售有限公司 ,会计, 西善桥 ,不限,,不限,会计/会计师,面议
 南京汇则税务师事务所（普通合… ,会计大四实习生, 西善桥 ,大专,"周末双休,交通补助,饭补,话补",不限,会计/会计师,面议
 南京昶邺建材有限公司 ,会计, 西善桥 ,不限,五险一金,不限,会计/会计师,4000-6000
 南京道兴交通工程有限公司 ,会计, 西善桥 ,不限,"五险一金,包吃,包住,周末双休,话补",不限,会计/会计师,3000-5000
 江苏大唐电气科技有限公司乐清… ,会计, 西善桥 ,中专,五险一金,3-5年,会计/会计师,3500-4000
 中建国锋（海南）建设集团江苏… ,会计, 西善桥 ,不限,,不限,会计/会计师,面议
 南京市江宁区蓝天劳保用品销售… ,会计/会计师, 西善桥 ,大专,"五险一金,周末双休,饭补",3-5年,会计/会计师,3500-4500
 南京从清太和文化传播有限公司 ,招聘会计+五险+吃住, 西善桥 ,不限,"五险一金,包吃,包住",不限,会计/会计师,4000-8000
 南京鹤壁天海电器销售有限公司 ,总账会计, 西善桥 ,本科,"五险一金,饭补,包住,年底双薪,交通补助",3-5年,会计/会计师,6000-7000
 双轮泵业南京销售有限公司 ,会计, 西善桥 ,大专,"五险一金,周末双休",3-5年,会计/会计师,4000-5000
 和县明发江湾大酒店有限公司 ,酒店直招总账会计高薪, 西善桥 ,大专,"包吃,包住",1-2年,会计/会计师,面议
 南京玛吉特新型建材有限公司 ,会计, 西善桥 ,不限,"五险一金,包住",不限,会计/会计师,5000-6000
 南京意扬雨花石有限公司 ,会计, 西善桥 ,大专,"五险一金,包吃,周末双休",3-5年,会计/会计师,面议
 南京市玄武区隋香敏餐厅 ,总账会计, 西善桥 ,大专,"五险一金,包吃,周末双休",3-5年,会计/会计师,面议
 南京绿磊装饰材料有限公司 ,会计, 西善桥 ,不限,"五险一金,包吃",不限,会计/会计师,面议
 南京博思扬科技发展有限公司 ,仓库管理兼会计, 西善桥 ,大专,"五险一金,话补,饭补",3-5年,会计/会计师,5000-6000
 南京君之强建筑工程有限公司 ,会计, 西善桥 ,大专,,3-5年,会计/会计师,3000-5000
 南京瑞程达建材有限公司 ,会计/会计师, 西善桥 ,中专,,3-5年,会计/会计师,5000-7000
 南京江宁麒泽门诊部有限公司 ,会计/会计师, 西善桥 ,大专,"五险一金,包住,饭补,加班补助",3-5年,会计/会计师,面议
 南京龙瑞财务咨询有限公司 ,实习会计高薪1年经验, 西善桥 ,不限,周末双休,不限,会计/会计师,面议
 南京龙瑞财务咨询有限公司 ,实习会计, 西善桥 ,不限,,不限,会计/会计师,面议
 南京青草地环保科技有限责任公司 ,会计实习, 西善桥 ,大专,,不限,会计/会计师,面议
 江苏霆峰建设工程有限公司 ,总账会计 出纳会计, 西善桥 ,本科,"五险一金,包吃,包住,房补,交通补助",1-2年,会计/会计师,面议
 南京m武立荣园林工程有限公司 ,会计, 西善桥 ,高中,,3-5年,会计/会计师,3000-5000
 宁盐府家味餐饮管理南京有限公司 ,会计, 西善桥 ,本科,周末双休,1年以下,会计/会计师,面议
 南京德莱金财务咨询有限公司 ,会计助理, 西善桥 ,不限,"五险一金,周末双休,年底双薪,交通补助,饭补",不限,会计/会计师,4400-5500
 南京珠联财务管理有限公司 ,会计/会计师, 西善桥 ,不限,"五险一金,年底双薪,加班补助",不限,会计/会计师,面议
 南京豪锐物业有限公司 ,会计, 西善桥 ,不限,包吃,不限,会计/会计师,面议
 南京益家一百商业管理有限公司 ,会计, 西善桥 ,大专,包住,不限,会计/会计师,面议
 南京市秦淮区恒义昊酒业销售中心 ,会计, 西善桥 ,大专,"五险一金,包吃,话补",不限,会计/会计师,3000-5000
 杭州七杰网络科技有限公司 ,汽车租赁公司会计, 西善桥 ,大专,五险一金,不限,会计/会计师,6000-10000
 江苏省鑫达财务咨询有限公司 ,会计, 西善桥 ,不限,"五险一金,周末双休,交通补助",3-5年,会计/会计师,3000-5000
 南京步云轩装饰工程有限公司 ,会计, 西善桥 ,不限,"五险一金,话补,交通补助,饭补",不限,会计/会计师,面议
 南京新来机械设备有限公司 ,会计, 西善桥 ,中专,周末双休,不限,会计/会计师,面议
 南京中泰消防设备有限公司 ,总账会计, 浦口区 ,不限,"五险一金,包住,饭补",不限,会计/会计师,面议
 江苏轩颖交通科技有限公司 ,材料会计, 浦口区 ,大专,"五险一金,包吃,周末双休",1-2年,会计/会计师,面议
 里歌智能科技（上海）有限公司 ,会计, 浦口区 ,大专,"五险一金,包住,话补,交通补助,加班补助",不限,会计/会计师,3000-5000
 南京卡米林商贸有限公司 ,会计, 浦口区 ,不限,,不限,会计/会计师,面议
 南京市秦淮区银百祥饰品店 ,流水账会计, 浦口区 ,不限,,不限,会计/会计师,3500-5000
 南京美欣交通材料有限公司 ,会计, 浦口区 ,本科,,10年以上,会计/会计师,面议
 江苏尚徐餐饮管理有限公司 ,会计, 浦口区 ,不限,"包吃,包住",不限,会计/会计师,3000-5000
 南京稼禾建设工程有限公司 ,会计, 浦口区 ,不限,,不限,会计/会计师,3000-5000
 南京吉奥达科技有限公司 ,会计/会计师, 浦口区 ,大专,"五险一金,周末双休,饭补",3-5年,会计/会计师,5000-6000
 南京蚂蚁旅游发展有限公司 ,会计, 浦口区 ,不限,"包吃,包住,加班补助",3-5年,会计/会计师,面议
 南京市玄武区奥彩企业管理咨询… ,实习会计, 浦口区 ,不限,"五险一金,周末双休",不限,会计/会计师,面议
 南京昂达市政工程有限公司 ,会计, 浦口区 ,大专,"五险一金,包吃,周末双休,年底双薪,话补",3-5年,会计/会计师,面议
 南京昂达市政工程有限公司 ,建筑会计, 浦口区 ,大专,"五险一金,包吃,周末双休,年底双薪,话补",3-5年,会计/会计师,面议
 南京罗金科技有限公司 ,会计, 浦口区 ,本科,"周末双休,加班补助",不限,会计/会计师,面议
 南京市江宁区博亿企业管理信息… ,急聘会计3年经验, 浦口区 ,本科,"饭补,话补,周末双休,交通补助,加班补助",3-5年,会计/会计师,5000-10000
 南京市秦淮区谭氏鸭血火锅店 ,谭鸭血老火锅聘会计, 浦口区 ,不限,"包吃,包住,年底双薪,话补,饭补",1-2年,会计/会计师,3700-4500
 南京彦平财务咨询有限公司 ,招聘会计 急招, 浦口区 ,大专,"五险一金,周末双休,年底双薪,饭补",3-5年,会计/会计师,面议
 南京华成厨具有限公司 ,有会计职称会计+有经验, 浦口区 ,不限,周末双休,3-5年,会计/会计师,面议
 南京鸿宇物业管理有限公司 ,会计, 浦口区 ,大专,"五险一金,周末双休",3-5年,会计/会计师,4000-6000
 南京聚太科技发展有限公司 ,会计, 浦口区 ,大专,"五险一金,饭补",不限,会计/会计师,3000-5000
 南京铁马汽配有限公司 ,会计, 浦口区 ,大专,"包吃,加班补助",1-2年,会计/会计师,5000-7000
 南京金展铝业有限公司 ,会计, 浦口区 ,不限,加班补助,不限,会计/会计师,3000-5000
 南京鸿宇物业管理有限公司 ,会计/出纳, 浦口区 ,大专,"五险一金,周末双休",1-2年,会计/会计师,3500-6000
 南京帝禾企业管理顾问有限公司 ,代账会计主管, 浦口区 ,大专,"五险一金,周末双休,交通补助,饭补,加班补助",1-2年,会计/会计师,面议
 南京恒瑞财务咨询有限公司 ,代账会计, 浦口区 ,不限,"五险一金,周末双休,饭补",1-2年,会计/会计师,3000-5000
 南京帝禾企业管理顾问有限公司 ,代账会计主管, 浦口区 ,大专,"周末双休,交通补助,饭补,五险一金",3-5年,会计/会计师,面议
 南京深业建材有限公司 ,会计出纳, 浦口区 ,大专,交通补助,3-5年,会计/会计师,面议
 南京九星财务管理顾问有限公司 ,诚聘会计周末双休, 浦口区 ,不限,周末双休,不限,会计/会计师,3000-4000
 上海程双建筑工程有限公司 ,会计, 浦口区 ,高中,"包吃,包住",不限,会计/会计师,3000-5000
 南京迪科达装饰工程有限公司 ,高薪急招财务出纳/大专, 浦口区 ,大专,"加班补助,交通补助,五险一金",1-2年,会计/会计师,3000-5000
 南京美标五金电器有限公司 ,会计/会计师, 浦口区 ,不限,,不限,会计/会计师,3000-5000
 江苏汇丰农机有限公司 ,会计, 浦口区 ,不限,"五险一金,周末双休,年底双薪,饭补",不限,会计/会计师,面议
 南京华顶酒店管理有限公司 ,会计, 浦口区 ,不限,周末双休,不限,会计/会计师,面议
 南京达力特挤出机械有限公司 ,会计, 浦口区 ,大专,,6-7年,会计/会计师,面议
 南京市秦淮区丹特斯建材销售中心 ,会计/会计师, 浦口区 ,不限,"五险一金,周末双休,年底双薪",不限,会计/会计师,面议
 江苏莱兴医疗科技有限公司 ,会计, 铁心桥 ,中专,"五险一金,年底双薪,话补",1-2年,会计/会计师,4000-6000
 南京创赢未来创客空间有限公司 ,会计, 铁心桥 ,不限,周末双休,不限,会计/会计师,3000-5000
 南京树企财务管理咨询有限公司 ,实习会计做账会计, 铁心桥 ,大专,"交通补助,周末双休,饭补",1年以下,会计/会计师,2500-5000
 南京军歌餐饮管理有限公司 ,财务会计高薪2年经验, 铁心桥 ,本科,"包吃,包住",3-5年,会计/会计师,6000-8000
 江苏蒙建建设有限公司 ,建筑总账会计, 铁心桥 ,不限,"周末双休,交通补助,饭补",不限,会计/会计师,面议
 南京火凤翼彩文化传播有限公司 ,会计, 铁心桥 ,大专,"五险一金,加班补助",不限,会计/会计师,5000-7000
 南京浦绿康洁环境卫生管理有限… ,财务会计, 铁心桥 ,大专,"饭补,话补",1-2年,会计/会计师,5000-6000
 南京聚梦医疗美容有限公司 ,总账会计, 铁心桥 ,不限,"包住,交通补助,饭补,加班补助,五险一金",不限,会计/会计师,面议
 南京创友财税管理有限公司 ,会计, 铁心桥 ,不限,"五险一金,周末双休,年底双薪,话补,交通补助",不限,会计/会计师,4000-6000
 南京携手工商代理有限公司 ,会计实习生, 铁心桥 ,大专,"五险一金,周末双休",不限,会计/会计师,1500-2500
 南京缬鸦械工程有限公司 ,出纳兼统计, 铁心桥 ,大专,"五险一金,周末双休,年底双薪",1-2年,会计/会计师,3500-5000
 南京天翠福贸易有限公司 ,会计, 铁心桥 ,本科,,1-2年,会计/会计师,3000-5000
 合肥居润建筑工程安装有限公司 ,主办会计, 铁心桥 ,大专,"五险一金,年底双薪,包吃,包住",1-2年,会计/会计师,5000-8000
 南京中全人力资源有限公司 ,开发区出纳, 铁心桥 ,不限,"求职保障,包吃,年底双薪,交通补助,话补,饭补",不限,会计/会计师,面议
 南京步鑫投资管理有限公司 ,会计, 铁心桥 ,大专,"五险一金,周末双休,交通补助",3-5年,会计/会计师,3500-5000
 南京市江宁区妍夫人皮草店 ,会计, 铁心桥 ,不限,,不限,会计/会计师,面议
 南京市栖霞区鸽味轩粤菜馆 ,餐饮会计, 铁心桥 ,不限,"包吃,饭补,周末双休,交通补助",3-5年,会计/会计师,6000-8000
 南京市栖霞区燕子矶联珠烟酒店 ,会计/会计师, 铁心桥 ,不限,,不限,会计/会计师,面议
 江苏佰岁通源健康管理有限公司 ,会计, 铁心桥 ,大专,"五险一金,周末双休",不限,会计/会计师,4000-6000
 南京俊程建设工程有限公司 ,会计, 铁心桥 ,不限,,不限,会计/会计师,3000-5000
 南京品意品牌策划管理有限公司 ,会计, 铁心桥 ,大专,"饭补,加班补助,五险一金,周末双休",1-2年,会计/会计师,5000-8000
 南京台达电系统工程有限公司 ,会计, 铁心桥 ,不限,周末双休,不限,会计/会计师,3000-5000
 南京市秦淮区义之和烟酒店 ,会计, 铁心桥 ,不限,,不限,会计/会计师,3000-5000
 南京市江宁区杨尚睿财务管理工… ,会计, 铁心桥 ,不限,"五险一金,周末双休",不限,会计/会计师,面议
 南京博赞源教育科技有限公司仙… ,财务, 铁心桥 ,不限,"求职保障,五险一金",3-5年,会计/会计师,5000-7000
 上海博九新能源技术有限公司 ,会计, 铁心桥 ,大专,"话补,交通补助,饭补",不限,会计/会计师,3000-5000
 南京市下关区李广林酒业经营部 ,会计, 铁心桥 ,不限,五险一金,不限,会计/会计师,面议
 南京云阔商贸有限公司 ,会计, 铁心桥 ,不限,,不限,会计/会计师,3000-5000
 义乌市享到商贸有限公司 ,会计, 铁心桥 ,不限,"包吃,包住",不限,会计/会计师,3000-5000
 南京鑫明置业有限公司 ,会计, 铁心桥 ,不限,"包吃,周末双休",1-2年,会计/会计师,面议
 南京奥窗建材有限公司 ,会计, 铁心桥 ,大专,,1-2年,会计/会计师,3000-5000
 南京达得拉汽车销售服务有限公司 ,会计, 铁心桥 ,大专,"五险一金,包吃,周末双休",3-5年,会计/会计师,面议
 南京东鑫物业管理有限公司 ,现金会计, 铁心桥 ,不限,,6-7年,会计/会计师,面议
 南京市秦淮区淘淘坊电子商务中心 ,会计, 铁心桥 ,不限,"五险一金,加班补助",不限,会计/会计师,4000-6000
 南京嘉悦大酒店有限公司 ,直招酒店会计, 铁心桥 ,本科,"包吃,包住",3-5年,会计/会计师,4000-6000
 南京乐孚国际贸易有限公司 ,会计, 秣陵 ,不限,,3-5年,会计/会计师,面议
 企途新（南京）科技有限公司 ,会计财务, 秣陵 ,大专,"五险一金,包吃,包住,周末双休,年底双薪",1-2年,会计/会计师,6000-8000
 徐州久翔电动车科技有限公司 ,会计, 秣陵 ,不限,五险一金,不限,会计/会计师,3000-5000
 南京奎将机电科技有限公司 ,会计五险一金周末双休, 秣陵 ,大专,"年底双薪,周末双休,加班补助,五险一金",1-2年,会计/会计师,4000-6000
 南京奎将机电科技有限公司 ,总账会计, 秣陵 ,大专,"年底双薪,周末双休,加班补助,五险一金",1-2年,会计/会计师,4000-6000
 南京爱源财务管理有限公司 ,会计, 秣陵 ,不限,五险一金,3-5年,会计/会计师,面议
 南京盛飞食品商贸有限公司 ,会计, 秣陵 ,大专,"五险一金,话补,交通补助,饭补",1-2年,会计/会计师,5000-5500
 江苏绿禾农林科技有限公司 ,会计, 秣陵 ,大专,"周末双休,交通补助,话补,饭补,加班补助",3-5年,会计/会计师,5000-6000
 南京奎将机电科技有限公司 ,主办会计, 秣陵 ,大专,"年底双薪,周末双休,加班补助,五险一金",1-2年,会计/会计师,4000-6000
 南京超盛新型环保建材有限公司 ,主办会计一名和统计一名, 秣陵 ,大专,,不限,会计/会计师,面议
 南京鑫怡通财务咨询有限公司 ,会计销售, 秣陵 ,不限,,不限,会计/会计师,面议
 南京弘誉广告有限公司 ,总账会计, 秣陵 ,不限,包吃,1-2年,会计/会计师,4500-6000
 南京诚品财务咨询有限公司 ,总账会计, 秣陵 ,大专,"五险一金,周末双休,年底双薪,交通补助,饭补",6-7年,会计/会计师,面议
 南京力木建设工程有限公司 ,会计/会计师, 秣陵 ,大专,"五险一金,周末双休,年底双薪",3-5年,会计/会计师,5000-8000
 南京力木建设工程有限公司 ,会计, 秣陵 ,不限,,不限,会计/会计师,面议
 南京国际装饰安装工程有限公司 ,会计, 秣陵 ,本科,五险一金,3-5年,会计/会计师,面议
 南京亮点财税管理咨询有限公司 ,实习会计会计, 秣陵 ,不限,"周末双休,五险一金,包吃,年底双薪,交通补助",不限,会计/会计师,3000-5000
 南京亮点财税管理咨询有限公司 ,实习会计, 秣陵 ,不限,"周末双休,五险一金,包吃,年底双薪,交通补助",不限,会计/会计师,面议
 江苏赛坤物流有限公司 ,会计, 秣陵 ,大专,"周末双休,五险一金,饭补",3-5年,会计/会计师,3000-4000
 江苏正士源建筑工程有限公司 ,会计有工程经验优先, 秣陵 ,不限,"周末双休,交通补助,饭补,话补",不限,会计/会计师,面议
 酒不醉（南京）网络科技有限公司 ,招会计, 秣陵 ,不限,"五险一金,包吃,交通补助",1-2年,会计/会计师,面议
 南京迈锐肯贸易有限公司 ,会计, 秣陵 ,本科,"五险一金,周末双休,加班补助,交通补助,饭补",1-2年,会计/会计师,2500-3000
 南京垦业科贸有限公司 ,会计, 秣陵 ,不限,周末双休,不限,会计/会计师,面议
 南京乐孚国际贸易有限公司 ,会计, 秣陵 ,不限,,3-5年,会计/会计师,面议
 南京超通汽配有限公司 ,财务, 秣陵 ,不限,,不限,会计/会计师,4000-5000
 南京日峰企业服务有限公司 ,摄山新城附近一成本会计岗, 秣陵 ,大专,"包吃,包住,年底双薪,饭补,加班补助",3-5年,会计/会计师,6000-6500
 南京中联广阔建设工程有限公司 ,会计, 秣陵 ,大专,,3-5年,会计/会计师,4000-6000
 南京市雨花台区盛中建材经营部 ,文员会计, 秣陵 ,本科,周末双休,3-5年,会计/会计师,5000-8000
 南京铿利建筑安装工程有限公司 ,会计, 秣陵 ,不限,,3-5年,会计/会计师,3000-5000
 来安香江置业有限公司 ,会计, 秣陵 ,不限,"包吃,包住,五险一金,加班补助,饭补",不限,会计/会计师,5500-8000
 南京丝享家服饰有限公司 ,会计/会计师, 秣陵 ,大专,"五险一金,周末双休",1-2年,会计/会计师,3000-5000
 南京金月唐装饰材料有限公司 ,公司会计, 秣陵 ,不限,"五险一金,周末双休,加班补助",不限,会计/会计师,4000-5000
 南京信运通物流有限公司 ,会计, 秣陵 ,本科,"五险一金,包吃,周末双休",3-5年,会计/会计师,面议
 南京新迪舒建材有限公司 ,会计, 秣陵 ,技校,"包吃,包住,加班补助",不限,会计/会计师,3000-5000
 南京旭合环保设备有限公司 ,会计/会计师, 秣陵 ,不限,"五险一金,包吃,包住,加班补助",不限,会计/会计师,面议
 南京和涛塑胶有限公司 ,会计, 淳化 ,不限,"五险一金,包吃,话补,加班补助",不限,会计/会计师,5000-6000
 上海烁原企业管理咨询中心（有… ,会计, 淳化 ,本科,,1-2年,会计/会计师,面议
 南京迪欧家具有限公司 ,会计, 淳化 ,不限,"五险一金,周末双休,年底双薪,饭补",不限,会计/会计师,3000-5000
 南京市秦淮区银百祥饰品店 ,会计, 淳化 ,技校,,不限,会计/会计师,3000-5000
 南京瑞翔新材料科技有限公司 ,会计/会计师, 淳化 ,不限,"五险一金,包吃,话补,饭补",8-10年,会计/会计师,面议
 马鞍山市旭轩商贸有限公司 ,会计, 淳化 ,不限,,不限,会计/会计师,面议
 南京江顺装饰工程有限公司 ,会计, 淳化 ,大专,"五险一金,包吃,话补",3-5年,会计/会计师,4000-6000
 南京华寅广告工程有限公司 ,会计, 淳化 ,大专,五险一金,不限,会计/会计师,4000-5500
 南京天地源食品有限公司 ,会计, 淳化 ,大专,,1-2年,会计/会计师,4000-5000
 南京国粹企业管理有限公司 ,会计/会计师, 淳化 ,不限,,不限,会计/会计师,面议
 南京雅克优点商贸有限公司 ,会计, 淳化 ,不限,"五险一金,年底双薪,加班补助",3-5年,会计/会计师,4000-8000
 南京顼骏贸易有限公司 ,会计, 淳化 ,不限,"五险一金,包吃,周末双休,年底双薪",3-5年,会计/会计师,面议
 南京亿航家具有限公司 ,会计, 淳化 ,不限,"包吃,包住",1-2年,会计/会计师,面议
 南京恒业汽车维修有限公司 ,急招会计, 淳化 ,不限,"五险一金,包吃,包住,加班补助,交通补助",不限,会计/会计师,3000-6000
 南京恩贝康医疗器械有限公司 ,会计, 淳化 ,不限,"五险一金,周末双休,饭补,加班补助",1-2年,会计/会计师,3000-5000
 江苏菲利科斯建设工程有限公司 ,会计/会计师, 淳化 ,大专,五险一金,3-5年,会计/会计师,面议
 南京市浦口区暖春科技信息咨询… ,实习会计, 淳化 ,不限,周末双休,不限,会计/会计师,面议
 南京留巷伊商贸有限公司 ,会计, 淳化 ,大专,"五险一金,年底双薪,加班补助",3-5年,会计/会计师,4000-5000
 江苏量伟建设工程有限公司 ,会计, 淳化 ,本科,周末双休,3-5年,会计/会计师,3000-5000
 北京市永昌房地产经纪有限公司… ,会计/会计师, 淳化 ,大专,包住,1-2年,会计/会计师,5000-6000
 南京惠悦财务咨询有限公司 ,会计助理, 淳化 ,大专,"周末双休,年底双薪,话补,交通补助,饭补",不限,会计/会计师,面议
 南京茅五兴晟电子商务有限公司 ,会计, 淳化 ,不限,年底双薪,不限,会计/会计师,面议
 南京华邺旅游有限公司 ,总账会计, 淳化 ,不限,,不限,会计/会计师,3000-4000
 南京万禾市政园林工程有限公司 ,会计, 淳化 ,大专,"五险一金,年底双薪,包住,包吃",3-5年,会计/会计师,6000-8000
 南京市江宁区松竹梅酒店 ,会计, 淳化 ,不限,"包吃,包住",不限,会计/会计师,3000-5000
 南京市江宁区松竹梅酒店 ,谷里街道招聘酒店会计, 淳化 ,不限,"包吃,包住",1-2年,会计/会计师,3000-5000
 江苏威风出行汽车租赁有限公司 ,总账会计, 淳化 ,大专,"五险一金,包吃,周末双休",3-5年,会计/会计师,5000-7000
 南京醉花亭餐饮文化有限公司 ,会计, 淳化 ,大专,,不限,会计/会计师,面议
 南京叠才财务管理有限公司 ,会计/会计师, 淳化 ,不限,"五险一金,周末双休,年底双薪,交通补助",不限,会计/会计师,3000-5000
 南京市秦淮区锦亦翔石材厂 ,石材会计, 淳化 ,不限,包吃,不限,会计/会计师,面议
 南京金勉智能系统工程有限公司 ,会计, 淳化 ,不限,"话补,饭补,五险一金,周末双休",不限,会计/会计师,面议
 南京鑫掌柜财务管理有限公司 ,实习会计江宁万达, 淳化 ,不限,"五险一金,周末双休,加班补助",不限,会计/会计师,面议
